{
  "$schema": "https://metais.org/schemas/conformance/1/vector.schema.json",
  "id": "pkg/name-git-upper",
  "title": "An entry name with a .GIT segment, .git in another case, is refused",
  "statements": [
    "MTS-PKG-016",
    "MTS-SEC-002"
  ],
  "since": "1.0",
  "class": "processor",
  "tags": [
    "security",
    "byte-level"
  ],
  "requires": [],
  "notes": "Its package.metais is written by internal/vectorgen (go test ./internal/vectorgen -run TestPackages -args -update), whose test reproduces the committed bytes.",
  "cases": [
    {
      "name": "open",
      "steps": [
        {
          "op": "open",
          "args": {
            "package": "package.metais"
          },
          "expect": {
            "ok": false,
            "findings": "expected/findings.json"
          },
          "bounds": {
            "cpu_ms": 500,
            "rss_mib": 64
          }
        }
      ]
    }
  ]
}
