{
  "$schema": "https://metais.org/schemas/conformance/1/vector.schema.json",
  "id": "aut/test-differences",
  "title": "A text difference is located at the first differing code point of the expected file, with a diff; a difference where a side holds a NUL byte is binary, and gives the first differing byte, both sizes and both digests",
  "statements": [
    "MTS-AUT-041"
  ],
  "since": "1.0",
  "class": "authoring",
  "tags": [],
  "requires": [],
  "notes": "",
  "cases": [
    {
      "name": "test",
      "steps": [
        {
          "op": "test",
          "args": {
            "source": "package"
          },
          "expect": {
            "ok": false,
            "findings": "expected/test.json"
          }
        }
      ]
    }
  ]
}
