{
  "$schema": "https://metais.org/schemas/conformance/1/vector.schema.json",
  "id": "sup/markdown-frontmatter",
  "title": "Frontmatter must close, hold a mapping and hold no body field",
  "statements": [
    "MTS-SUP-012"
  ],
  "since": "1.0",
  "class": "processor",
  "tags": [],
  "requires": [],
  "notes": "",
  "cases": [
    {
      "name": "invalid",
      "steps": [
        {
          "op": "validate",
          "args": {
            "package": "package",
            "data": "data/invalid"
          },
          "expect": {
            "ok": false,
            "findings": "expected/invalid.json"
          }
        }
      ]
    }
  ]
}
