{
  "$schema": "https://metais.org/schemas/conformance/1/vector.schema.json",
  "id": "flt/duration",
  "title": "duration writes whole seconds and ISO 8601 durations by its directives, dropping what lies below the smallest unit named",
  "statements": [
    "MTS-FLT-021",
    "MTS-FLT-022"
  ],
  "since": "1.0",
  "class": "processor",
  "tags": [
    "determinism"
  ],
  "requires": [],
  "notes": "",
  "cases": [
    {
      "name": "render",
      "steps": [
        {
          "op": "render",
          "args": {
            "package": "package",
            "out": "out",
            "data": "data"
          },
          "expect": {
            "ok": true,
            "trees": [
              {
                "path": "out",
                "equals": "expected/out"
              }
            ]
          }
        }
      ]
    }
  ]
}
