{
  "$schema": "https://metais.org/schemas/conformance/1/vector.schema.json",
  "id": "man/manifest-size",
  "title": "A manifest over a lowered manifest-size is refused before it is read",
  "statements": [
    "MTS-MAN-020",
    "MTS-SEC-001"
  ],
  "since": "1.0",
  "class": "processor",
  "tags": [
    "limits"
  ],
  "requires": [],
  "notes": "",
  "cases": [
    {
      "name": "open",
      "steps": [
        {
          "op": "open",
          "args": {
            "package": "package",
            "limits": {
              "manifest-size": 64
            }
          },
          "expect": {
            "ok": false,
            "findings": "expected/findings.json"
          }
        }
      ]
    }
  ]
}
