{
  "$schema": "https://metais.org/schemas/conformance/1/vector.schema.json",
  "id": "pkg/opens-source",
  "title": "A valid source directory with every part a package may have opens",
  "statements": [
    "MTS-PKG-001",
    "MTS-PKG-031",
    "MTS-PKG-033",
    "MTS-MAN-001"
  ],
  "since": "1.0",
  "class": "processor",
  "tags": [],
  "requires": [],
  "notes": "",
  "cases": [
    {
      "name": "open",
      "steps": [
        {
          "op": "open",
          "args": {
            "package": "package"
          },
          "expect": {
            "ok": true
          }
        }
      ]
    }
  ]
}
