{
  "$schema": "https://metais.org/schemas/conformance/1/vector.schema.json",
  "id": "aut/test-now",
  "title": "An example renders as a render does, with the render time example.yaml gives normalized to UTC, or with none",
  "statements": [
    "MTS-AUT-038"
  ],
  "since": "1.0",
  "class": "authoring",
  "tags": [
    "determinism"
  ],
  "requires": [],
  "notes": "",
  "cases": [
    {
      "name": "test",
      "steps": [
        {
          "op": "test",
          "args": {
            "source": "package"
          },
          "expect": {
            "ok": true
          }
        }
      ]
    }
  ]
}
