{
  "$schema": "https://metais.org/schemas/conformance/1/vector.schema.json",
  "id": "dat/compiled-schema-mismatch",
  "title": "A combined schema that is not the one the sources derive is refused",
  "statements": [
    "MTS-DAT-009",
    "MTS-PKG-025"
  ],
  "since": "1.0",
  "class": "processor",
  "tags": [
    "security",
    "byte-level"
  ],
  "requires": [],
  "notes": "Its package.metais is written by internal/vectorgen (go test ./internal/vectorgen -run TestPackages -args -update), whose test reproduces the committed bytes.",
  "cases": [
    {
      "name": "open",
      "steps": [
        {
          "op": "open",
          "args": {
            "package": "package.metais"
          },
          "expect": {
            "ok": false,
            "findings": "expected/findings.json"
          }
        }
      ]
    }
  ]
}
